<?xml version="1.0" encoding="utf-8" ?>
<Properties xmlns="http://www.example.org/Properties" xmlns:xsi="http://www.w3.org/2001/XMLSchema-instance"
            xsi:schemaLocation="http://www.example.org/Properties ../../Schema/Properties.xsd ">
  <property key="baseWSPrefix" value="SW"/>
  <property key="externalSystemName" value="SW" />
  <property key="wsprovider" value="mif" />
  <property key="basewsURL" value="http://192.168.2.105:9080/meaweb/wsdl/" />
  <property key="maximo_DB_url" value="Data Source=192.168.2.105;Initial Catalog=SWMAX;User Id=MAXIMO;password=MAXIMO;" />
  <property key="maximo_DB_provider" value="System.Data.SQL"/>
  <property key="swdb_provider" value="System.Data.SQL"/>
  
  <property key="defaultOrgId" value="EAGLENA"/>
  <property key="defaultSiteId" value="BEDFORD"/>
  <property key="sourcemapping" value="maximo7.5"/>
  

  <environment key="dev">
    <property key="swdb_url" value="Data Source=192.168.2.105;Initial Catalog=SWDB_SWMAX;User Id=sw;password=softwrench;" />
  </environment>

  <environment key="qa">
    <property key="swdb_url" value="Data Source=192.168.2.105;Initial Catalog=SWDB_SWMAX;User Id=sw;password=softwrench;" />
  </environment>

</Properties>
  
 
  

