<?xml version="1.0" encoding="utf-8" ?>
<Properties xmlns="http://www.example.org/Properties" xmlns:xsi="http://www.w3.org/2001/XMLSchema-instance"
            xsi:schemaLocation="http://www.example.org/Properties ../../Schema/Properties.xsd ">
  <property key="baseWSPrefix" value="SW"/>
  <property key="externalSystemName" value="SW" />

  <property key="basewsURL" value="http://tva75dev.cts.com:9080/meaweb/wsdl/" />
  <property key="maximo_DB_url" value="Data Source=10.50.100.51;Initial Catalog=TVA75MAX;User Id=MAXIMO;password=MAXIMO;" />
  <property key="swdb_url" value="Data Source=10.50.100.51;Initial Catalog=SWDB_TVA75MAX;User Id=sw;password=softwrench;" />
  <property key="maximo_DB_provider" value="System.Data.SQL"/>
  
  <property key="swdb_provider" value="System.Data.SQL"/>
  <property key="maxAttachmentSize" value="10"/> <!--in MB-->
  <property key="maxScreenshotSize" value="5"/> <!-- in MB-->
  <property key="allowedAttachmentExtensions" value="pdf,zip,txt,jpg,bmp,doc,docx,dwg,csv,xls,xlsx,ppt,xml,xsl,html,rtf,png"/>
  <property key="defaultOrgId" value="EAGLENA"/>
  <property key="defaultSiteId" value="BEDFORD"/>

  <property key="wsprovider" value="mif" />
  <property key="sourcemapping" value="maximo7.5"/>
  <property key="targetmapping" value="tvamaximo_target"/>
  
  <property key="email.smtp.host" value="mail.softwrenchsolutions.com"/>
  <!--property key="email.smtp.port" value="587"/-->
  <property key="email.stmp.enableSSL" value="true"/>

  <environment key="dev62">
    <property key="maximo_DB_url" value="Data Source=10.50.100.43;Initial Catalog=TVA62MAX;User Id=MAXIMO;password=Max7118;" />
    <property key="swdb_url" value="Data Source=10.50.100.43;Initial Catalog=SWDB_TVA75MAX;User Id=sw;password=softwrench;" />
    <property key="wsprovider" value="mea" />
    <property key="basewsURL" value="http://tva62dev.cts.com/meaweb/services/" />
  </environment>

  <environment key="dev75">
    <property key="maximo_DB_url" value="Data Source=10.50.100.51;Initial Catalog=TVA75MAX;User Id=MAXIMO;password=MAXIMO;" />
    <property key="swdb_url" value="Data Source=10.50.100.43;Initial Catalog=SWDB_TVA75MAX;User Id=sw;password=softwrench;" />
    <property key="wsprovider" value="mif" />
    <property key="basewsURL" value="http://tva75dev.cts.com:9080/meaweb/wsdl/" />
  </environment>


</Properties>
  
 
  

