<?xml version="1.0" encoding="utf-8" ?>
<Properties xmlns="http://www.example.org/Properties" xmlns:xsi="http://www.w3.org/2001/XMLSchema-instance"
            xsi:schemaLocation="http://www.example.org/Properties ../../Schema/Properties.xsd ">

	<property key="list.click.mode" value="output"/>
	<property key="list.click.popupmode" value="browser"/>
	<property key="popup.window.titlestrategy" value="idonly"/>
	<property key="baseWSPrefix" value="MXSW4"/>
	<property key="externalSystemName" value="SW" />
	<property key="defaultOrgId" value="EAGLENA"/>
	<property key="defaultSiteId" value="BEDFORD"/>
	<property key="faqfspath" value="C:\faqAttachments\" />
	<property key="i18nrequired" value="true" />
	<property key="list.paginationsize" value="100"/>
	<property key="list.paginationoptions" value="10,30,100"/>
	<property key="list.advancedfilter.showsearchicon" value="false"/>
	<property key="successmessagetimeout" value="10000"/>

	<property key="maximo_DB_provider" value="IBM.Data.DB2" />
	<property key="maximoutc" value="-7"/>
	<property key="sourcemapping" value="maximo7.2.1"/>
	<!--  <property key="wsprovider" value="mif" />-->
	<property key="targetmapping" value="ism"/>
	<property key="multitenantprefix" value="HLC-%"/>
	<property key="globaservletpath" value="https://170.225.28.205/HAPAGLLOYDINCTestWS/DocHandlerServlet"/>
	<property key="ignorewscerterrors" value="true"/>

	<property key="faqusefullinksPath" value="C:\ServiceIT\config\SR_FAQ.txt"/>
	<property key="serviceItLoginPath" value="C:\ServiceIT\config\ServiceITLogin.properties"/>
	<property key="businessmatrixPath" value="C:\ServiceIT\config\businessmatrix"/>
	<property key="ssoServicesQueryPath" value="C:\ServiceIT\config\SSO_SERVICES_QUERY.txt"/>
	<property key="loginErrorMessage" value="Ungültiger Username oder falsches Passwort \n Invalid Username or Bad Password \n No válido Nombre de usuario o contraseña incorreta"/>
	<property key="loginUserNameMessage" value="Username is required \n Username wird benötigt \n nombre de usuario es necessario"/>
	<property key="loginPasswordMessage" value="Password is required \n Passwort wird benötigt \n se requiere contraseña"/>
	<property key="defaultChangeTeamplateId" value="HLCDECHG"/>
	<property key="ssoChangeTeamplateId" value="HLCDECHSSO"/>
	<property key="tuiChangeTeamplateId" value="HLCDECHTUI"/>

	<environment key="dev">
		<!--    <property key="wsprovider" value="mif" />-->
		<!--    <property key="targetmapping" value="maximo7.2.1"/>-->
		<property key="globalwsdlpath" value="https://170.225.28.205/MPWSNTestProxyWS/DocHandler?wsdl"/>
		<property key="globaservletpath_inc" value="https://170.225.28.205/HAPAGLLOYDINCTestWS/DocHandlerServlet"/>
		<property key="globaservletpath_chg" value="https://170.225.28.205/HAPAGLLOYDCHGTestWS/DocHandlerServlet"/>
		<property key="maximo_DB_url" value="Server=66.235.236.8:50005;Database=maxdb71;UID=maximo;PWD=Max1mo;CurrentSchema=maximo" />
		<property key="basewsURL" value="http://66.235.236.8/meaweb/wsdl/" />
		<property key="swdb_url" value="server=66.235.236.8;database=swdb_hapagdev;UID=sw;Pwd=sw;" />
		<property key="swdb_provider" value="MySql.Data.MySqlClient" />
		<property key="ldap.synceverytime" value="true"/>
		<property key="ldap.allownonmaximousers" value="true"/>
		<property key="ismcredentials.user" value="hl2tkbrg"/>
		<property key="ismcredentials.password" value="xK7AgFqJJQ"/>
	</environment>
	<environment key="qa">
		<property key="maximo_DB_url" value="Server=66.235.236.8:50005;Database=maxdb71;UID=maximo;PWD=Max1mo;CurrentSchema=maximo" />
		<property key="basewsURL" value="http://66.235.236.8/meaweb/wsdl/" />
		<property key="swdb_url" value="server=66.235.236.8;database=swdb_hapagqa;UID=sw;Pwd=sw;" />
		<property key="swdb_provider" value="MySql.Data.MySqlClient" />
	</environment>
	<environment key="prod">
		<property key="maximoutc" value="0"/>
		<property key="globalwsdlpath" value="https://170.225.28.205/MPWSNTestProxyWS/DocHandler?wsdl"/>
		<property key="globaservletpath_inc" value="https://170.225.28.205/HAPAGLLOYDINCTestWS/DocHandlerServlet"/>
		<property key="globaservletpath_chg" value="https://170.225.28.205/HAPAGLLOYDCHGTestWS/DocHandlerServlet"/>
		<property key="maximo_DB_url" value="Server=10.132.160.133:5101;Database=maximo;UID=maxsas;PWD=cD2g3nik;currentSchema=maximo;" />
		<property key="swdb_url" value="Data Source=localhost;Initial Catalog=swdb;User Id=swdb;password=sw;" />
		<property key="swdb_provider" value="System.Data.SQL" />
		<property key="ldapServer" value="adquery.hlag.com"/>
		<property key="ldapPortNumber" value="389"/>
		<property key="ldapBaseDn" value="dc=ww,dc=hl,dc=lan"/>
		<property key="targetmapping" value="ism"/>
		<property key="ldap.synceverytime" value="true"/>
		<property key="ldap.allownonmaximousers" value="true"/>
		<property key="basewsURL" value="C:\ServiceIT\config\mifwsdl\PROD\" />
		<property key="mifcredentials.user" value="dey99msy@ww.hl.lan"/>
		<property key="mifcredentials.password" value="maximo16"/>
		<property key="ismcredentials.user" value="hl2tkbrg"/>
		<property key="ismcredentials.password" value="xK7AgFqJJQ"/>
	</environment>

	<environment key="produat">
		<property key="maximoutc" value="0"/>
		<property key="globalwsdlpath" value="https://170.225.28.205/MPWSNTestProxyWS/DocHandler?wsdl"/>
		<property key="globaservletpath_inc" value="https://170.225.28.205/HAPAGLLOYDINCUATWS/DocHandlerServlet"/>
		<property key="globaservletpath_chg" value="https://170.225.28.205/HAPAGLLOYDCHGUATWS/DocHandlerServlet"/>
		<property key="maximo_DB_url" value="Server=10.132.160.132:5102;Database=maximo;UID=maxsas;PWD=xmax4sas;currentSchema=maximo;" />
		<property key="swdb_url" value="Data Source=localhost;Initial Catalog=swdb;User Id=sw;password=hapag123;" />
		<property key="swdb_provider" value="System.Data.SQL" />
		<property key="ldapServer" value="adquery.hlag.com"/>
		<property key="ldapPortNumber" value="389"/>
		<property key="ldapBaseDn" value="dc=ww,dc=hl,dc=lan"/>
		<property key="targetmapping" value="ism"/>
		<property key="ldap.synceverytime" value="true"/>
		<property key="ldap.allownonmaximousers" value="true"/>
		<property key="basewsURL" value="C:\ServiceIT\config\mifwsdl\UAT\" />
		<property key="mifcredentials.user" value="dey99msy@ww.hl.lan"/>
		<property key="mifcredentials.password" value="maximo16"/>
		<property key="ismcredentials.user" value="hl2tkbrg"/>
		<property key="ismcredentials.password" value="xK7AgFqJJQ"/>
	</environment>


</Properties>




