<?xml version="1.0" encoding="utf-8" ?>
<Properties xmlns="http://www.example.org/Properties" xmlns:xsi="http://www.w3.org/2001/XMLSchema-instance"
            xsi:schemaLocation="http://www.example.org/Properties ../../Schema/Properties.xsd ">
  <property key="baseWSPrefix" value="SW"/>
  <property key="externalSystemName" value="SW" />
  <property key="wsprovider" value="mif" />
  <property key="basewsURL" value="http://66.235.236.83/meaweb/wsdl/" />
  <property key="maximo_DB_url" value="Data Source=192.168.2.21;Initial Catalog=KONGSUAT;User Id=MAXIMO;password=MAXIMO;" />
  <property key="maximo_DB_provider" value="System.Data.SQL"/>
  <property key="swdb_provider" value="System.Data.SQL"/>

  <property key="defaultOrgId" value="KOGT"/>
  <property key="defaultSiteId" value="SUPPORT24"/>
  <property key="email.smtp.host" value="mail.softwrenchsolutions.com"/>
  <!--property key="email.smtp.port" value="587"/-->
  <property key="email.stmp.enableSSL" value="true"/>

  <property key="sourcemapping" value="smartcloud7.5"/>
  <property key="targetmapping" value="smartcloud7.5"/>


  <environment key="dev">
    <property key="swdb_url" value="Data Source=192.168.2.21;Initial Catalog=SWDB_KONGSUAT;User Id=sw;password=softwrench;" />
  </environment>

  <environment key="qa">
    <property key="swdb_url" value="Data Source=192.168.2.21;Initial Catalog=SWDB_OTBQA;User Id=sw;password=softwrench;" />
  </environment>

</Properties>
  
 
  

