<?xml version="1.0" encoding="utf-8" ?>
<Properties xmlns="http://www.example.org/Properties" ''
            xsi:schemaLocation="http://www.example.org/Properties ../../Schema/Properties.xsd ">

  <property key="baseWSPrefix" value="SW"/>
  <property key="externalSystemName" value="SW" />
  <property key="wsprovider" value="mif" />
  <property key="maximo_DB_provider" value="System.Data.SQL"/>
  <property key="swdb_provider" value="System.Data.SQL"/>
  <property key="defaultOrgId" value="EAGLENA"/>
  <property key="defaultSiteId" value="VQ"/>
  <property key="composition.mainbuttonstoshow" value="cancel"/>
  <property key="sourcemapping" value="maximo7.5"/>


  <environment key="dev">
    <property key="basewsURL" value="http://66.235.236.5/meaweb/wsdl/" />
    <property key="maximo_DB_url" value="Data Source=66.235.236.7;Initial Catalog=DEMO2MAX;User Id=MAXIMO;password=MAXIMO;" />
    <property key="swdb_url" value="Data Source=66.235.236.7;Initial Catalog=swdb_scottsdale;User Id=sw;password=softwrench;" />
  </environment>

  <environment key="qa">
    <property key="basewsURL" value="http://192.168.2.107/meaweb/wsdl/" />
    <property key="maximo_DB_url" value="Data Source=192.168.2.21;Initial Catalog=GRC75MAX;User Id=MAXIMO;password=MAXIMO;" />
    <property key="swdb_url" value="Data Source=192.168.2.21;Initial Catalog=SWDB;User Id=sw;password=sw@dm1n;" />
    <property key="ldapServer" value="192.168.2.11"/>
    <property key="ldapPortNumber" value="389"/>
    <property key="ldapBaseDn" value="ou=GROUPS,ou=MAXIMO,dc=sas,dc=local"/>
    <property key="mifcredentials.user" value="maxadmin"/>
    <property key="mifcredentials.password" value="M@xadm1n"/>
  </environment>
</Properties>
  
 
  

